{
  "schema_version": "1.0",
  "record_id": "asn-example",
  "record_type": "assignment",
  "created_at": "2026-09-13T12:00:00Z",
  "assignment_id": "asn-example",
  "objective": "Demonstrate a structurally valid assignment.",
  "scope": ["examples"],
  "constraints": [],
  "acceptance_criteria": ["The assignment validates."],
  "lifecycle_state": "planning",
  "execution_authority": "unauthorized",
  "ownership": { "manager_instance_id": "mgr-example" },
  "policy_snapshot": { "digest": "sha256:example" },
  "task_ids": []
}
